### ISSUE TITLE
Plastic Cloud -> local Plastic replication does not work on GCE

### ISSUE THREAD

**Issue by Kalmalyzer** [falldamagestudio/plastic-cloud-to-ucb#15]
When deployed to a VM on Google Compute Engine, the "cm replicate" command does not work correctly. It works from Virtualbox on a Windows host and from a VM on Azure, so it seems to be networking related. Codice Software does not yet have a solution.

For the time being, you should run this on Azure.

**Comment by Kalmalyzer** [comment]
It seems that this has something to do with MTUs not being configured correctly when running Docker on GCE.

According to [GCE's own troubleshooting page](https://cloud.google.com/compute/docs/troubleshooting), the GCE network has a max MTU of 1460 bytes, and the OS images provided by Google are set to this MTU.

If I setup a VM with gcloud then the MTU for eth0 is 1460:
```
gcloud.cmd compute instances create test2 --image-family ubuntu-1404-lts --image-project ubuntu-os-cloud
gcloud.cmd compute ssh test2
...
ifconfig
<shows MTU of 1460 for eth0>
```
If I setup a VM with gcloud and then tell docker-machine to install itself to it then the eth0 MTU is 1460 but the docker0 MTU is 1500:
```
gcloud.cmd compute instances create test2 --image-family ubuntu-1404-lts --image-project ubuntu-os-cloud
docker-machine create --driver google --google-zone europe-west1-b --google-project plastic-cloud-to-ucb-gce --google-use-existing test2
docker-machine ssh test2
...
docker-user@test2:~$ ifconfig
docker0   Link encap:Ethernet  HWaddr 02:42:a8:d2:50:aa
          inet addr:172.17.0.1  Bcast:0.0.0.0  Mask:255.255.0.0
          UP BROADCAST MULTICAST  MTU:1500  Metric:1
          RX packets:0 errors:0 dropped:0 overruns:0 frame:0
          TX packets:0 errors:0 dropped:0 overruns:0 carrier:0
          collisions:0 txqueuelen:0
          RX bytes:0 (0.0 B)  TX bytes:0 (0.0 B)

eth0      Link encap:Ethernet  HWaddr 42:01:0a:84:00:04
          inet addr:10.132.0.4  Bcast:10.132.0.4  Mask:255.255.255.255
          inet6 addr: fe80::4001:aff:fe84:4/64 Scope:Link
          UP BROADCAST RUNNING MULTICAST  MTU:1460  Metric:1
          RX packets:5015 errors:0 dropped:0 overruns:0 frame:0
          TX packets:4387 errors:0 dropped:0 overruns:0 carrier:0
          collisions:0 txqueuelen:1000
          RX bytes:35693224 (35.6 MB)  TX bytes:607503 (607.5 KB)

lo        Link encap:Local Loopback
          inet addr:127.0.0.1  Mask:255.0.0.0
          inet6 addr: ::1/128 Scope:Host
          UP LOOPBACK RUNNING  MTU:65536  Metric:1
          RX packets:0 errors:0 dropped:0 overruns:0 frame:0
          TX packets:0 errors:0 dropped:0 overruns:0 carrier:0
          collisions:0 txqueuelen:1
          RX bytes:0 (0.0 B)  TX bytes:0 (0.0 B)
```

Perhaps the eth0 MTU = 1460, docker0 MTU = 1500 is what is causing the problems? Also, is there a difference if docker-machine's google driver is used to provision the VM as well?

**Comment by Kalmalyzer** [comment]
And finally, after doing `./commands/build.sh` and `./commands/up.sh` and log in with `gcloud.cmd compute ssh <machine name>` then the network config is mostly - but not all - MTU=1500 on the host:

```
Kalms@plastic-cloud-to-ucb-gce:~$ ifconfig
br-05df2638255e Link encap:Ethernet  HWaddr 02:42:9c:f2:c3:09
          inet addr:172.18.0.1  Bcast:0.0.0.0  Mask:255.255.0.0
          inet6 addr: fe80::42:9cff:fef2:c309/64 Scope:Link
          UP BROADCAST RUNNING MULTICAST  MTU:1500  Metric:1
          RX packets:24 errors:0 dropped:0 overruns:0 frame:0
          TX packets:15 errors:0 dropped:0 overruns:0 carrier:0
          collisions:0 txqueuelen:0
          RX bytes:2668 (2.6 KB)  TX bytes:1328 (1.3 KB)

docker0   Link encap:Ethernet  HWaddr 02:42:02:e7:58:23
          inet addr:172.17.0.1  Bcast:0.0.0.0  Mask:255.255.0.0
          inet6 addr: fe80::42:2ff:fee7:5823/64 Scope:Link
          UP BROADCAST MULTICAST  MTU:1500  Metric:1
          RX packets:9638 errors:0 dropped:0 overruns:0 frame:0
          TX packets:10071 errors:0 dropped:0 overruns:0 carrier:0
          collisions:0 txqueuelen:0
          RX bytes:583058 (583.0 KB)  TX bytes:161681551 (161.6 MB)

eth0      Link encap:Ethernet  HWaddr 42:01:0a:84:00:03
          inet addr:10.132.0.3  Bcast:10.132.0.3  Mask:255.255.255.255
          inet6 addr: fe80::4001:aff:fe84:3/64 Scope:Link
          UP BROADCAST RUNNING MULTICAST  MTU:1460  Metric:1
          RX packets:20595 errors:0 dropped:0 overruns:0 frame:0
          TX packets:21047 errors:0 dropped:0 overruns:0 carrier:0
          collisions:0 txqueuelen:1000
          RX bytes:266381638 (266.3 MB)  TX bytes:2393828 (2.3 MB)

lo        Link encap:Local Loopback
          inet addr:127.0.0.1  Mask:255.0.0.0
          inet6 addr: ::1/128 Scope:Host
          UP LOOPBACK RUNNING  MTU:65536  Metric:1
          RX packets:0 errors:0 dropped:0 overruns:0 frame:0
          TX packets:0 errors:0 dropped:0 overruns:0 carrier:0
          collisions:0 txqueuelen:1
          RX bytes:0 (0.0 B)  TX bytes:0 (0.0 B)

veth12f5420 Link encap:Ethernet  HWaddr 9e:b2:be:22:6f:fe
          inet6 addr: fe80::9cb2:beff:fe22:6ffe/64 Scope:Link
          UP BROADCAST RUNNING MULTICAST  MTU:1500  Metric:1
          RX packets:8 errors:0 dropped:0 overruns:0 frame:0
          TX packets:21 errors:0 dropped:0 overruns:0 carrier:0
          collisions:0 txqueuelen:0
          RX bytes:648 (648.0 B)  TX bytes:1626 (1.6 KB)

veth9d7bb4b Link encap:Ethernet  HWaddr 8a:43:15:fc:b6:5a
          inet6 addr: fe80::8843:15ff:fefc:b65a/64 Scope:Link
          UP BROADCAST RUNNING MULTICAST  MTU:1500  Metric:1
          RX packets:16 errors:0 dropped:0 overruns:0 frame:0
          TX packets:31 errors:0 dropped:0 overruns:0 carrier:0
          collisions:0 txqueuelen:0
          RX bytes:2356 (2.3 KB)  TX bytes:2624 (2.6 KB)
```

**Comment by Kalmalyzer** [comment]
however if I log in to the same box with with `docker-machine ssh` then the MTUs are different:

```
br-09385e48948b Link encap:Ethernet  HWaddr 02:42:FA:E2:DE:BD
          inet addr:172.18.0.1  Bcast:0.0.0.0  Mask:255.255.0.0
          inet6 addr: fe80::42:faff:fee2:debd/64 Scope:Link
          UP BROADCAST RUNNING MULTICAST  MTU:1500  Metric:1
          RX packets:45 errors:0 dropped:0 overruns:0 frame:0
          TX packets:17 errors:0 dropped:0 overruns:0 carrier:0
          collisions:0 txqueuelen:0
          RX bytes:3360 (3.2 KiB)  TX bytes:1403 (1.3 KiB)

docker0   Link encap:Ethernet  HWaddr 02:42:90:18:88:4E
          inet addr:172.17.0.1  Bcast:0.0.0.0  Mask:255.255.0.0
          UP BROADCAST MULTICAST  MTU:1500  Metric:1
          RX packets:0 errors:0 dropped:0 overruns:0 frame:0
          TX packets:0 errors:0 dropped:0 overruns:0 carrier:0
          collisions:0 txqueuelen:0
          RX bytes:0 (0.0 B)  TX bytes:0 (0.0 B)

eth0      Link encap:Ethernet  HWaddr 08:00:27:C3:43:C8
          inet addr:10.0.2.15  Bcast:10.0.2.255  Mask:255.255.255.0
          inet6 addr: fe80::a00:27ff:fec3:43c8/64 Scope:Link
          UP BROADCAST RUNNING MULTICAST  MTU:1500  Metric:1
          RX packets:1806 errors:0 dropped:0 overruns:0 frame:0
          TX packets:1357 errors:0 dropped:0 overruns:0 carrier:0
          collisions:0 txqueuelen:1000
          RX bytes:245248 (239.5 KiB)  TX bytes:300857 (293.8 KiB)

eth1      Link encap:Ethernet  HWaddr 08:00:27:13:29:82
          inet addr:192.168.99.100  Bcast:192.168.99.255  Mask:255.255.255.0
          inet6 addr: fe80::a00:27ff:fe13:2982/64 Scope:Link
          UP BROADCAST RUNNING MULTICAST  MTU:1500  Metric:1
          RX packets:3178 errors:0 dropped:0 overruns:0 frame:0
          TX packets:326 errors:0 dropped:0 overruns:0 carrier:0
          collisions:0 txqueuelen:1000
          RX bytes:442333 (431.9 KiB)  TX bytes:364585 (356.0 KiB)

lo        Link encap:Local Loopback
          inet addr:127.0.0.1  Mask:255.0.0.0
          inet6 addr: ::1/128 Scope:Host
          UP LOOPBACK RUNNING  MTU:65536  Metric:1
          RX packets:32 errors:0 dropped:0 overruns:0 frame:0
          TX packets:32 errors:0 dropped:0 overruns:0 carrier:0
          collisions:0 txqueuelen:1
          RX bytes:2752 (2.6 KiB)  TX bytes:2752 (2.6 KiB)

veth906f4d3 Link encap:Ethernet  HWaddr 66:3A:43:23:5C:99
          inet6 addr: fe80::643a:43ff:fe23:5c99/64 Scope:Link
          UP BROADCAST RUNNING MULTICAST  MTU:1500  Metric:1
          RX packets:21 errors:0 dropped:0 overruns:0 frame:0
          TX packets:24 errors:0 dropped:0 overruns:0 carrier:0
          collisions:0 txqueuelen:0
          RX bytes:2046 (1.9 KiB)  TX bytes:1961 (1.9 KiB)

vetha637f07 Link encap:Ethernet  HWaddr A6:AB:26:B0:F8:A6
          inet6 addr: fe80::a4ab:26ff:feb0:f8a6/64 Scope:Link
          UP BROADCAST RUNNING MULTICAST  MTU:1500  Metric:1
          RX packets:8 errors:0 dropped:0 overruns:0 frame:0
          TX packets:17 errors:0 dropped:0 overruns:0 carrier:0
          collisions:0 txqueuelen:0
          RX bytes:648 (648.0 B)  TX bytes:1338 (1.3 KiB)
```

**Comment by Kalmalyzer** [comment]
Using instructions such as those from https://rahulait.wordpress.com/2016/02/28/modifying-default-mtu-for-docker-containers/ does not make any difference to the MTU value for the docker bridges etc. ifconfig on the host can be used to adjust down the MTU values manually. The MTU for eth0 inside of the plastic container remains at 1500 though - and there is no change in Plastic's behaviour.

**Comment by Kalmalyzer** [comment]
tcpdump taken to/from port 10501 (which should be the one which is problematic) on the host:

```
16:55:27.333550 IP (tos 0x0, ttl 64, id 62931, offset 0, flags [none], proto TCP (6), length 60)
    172.18.0.3.36905 > 104.40.182.56.10501: Flags [S], cksum 0xcaa4 (incorrect -> 0xf46f), seq 1448511727, win 29200, options [mss 1460,sackOK,TS val 1867385 ecr 0,nop,wscale 7], length 0
16:55:27.348481 IP (tos 0x0, ttl 113, id 22163, offset 0, flags [DF], proto TCP (6), length 60)
    104.40.182.56.10501 > 172.18.0.3.36905: Flags [S.], cksum 0xa70c (correct), seq 3909288206, ack 1448511728, win 8192, options [mss 1440,nop,wscale 8,sackOK,TS val 164277145 ecr 1867385], length 0
16:55:27.348521 IP (tos 0x0, ttl 64, id 62934, offset 0, flags [none], proto TCP (6), length 52)
    172.18.0.3.36905 > 104.40.182.56.10501: Flags [.], cksum 0xca9c (incorrect -> 0xf4dc), ack 1, win 229, options [nop,nop,TS val 1867389 ecr 164277145], length 0
16:55:27.349125 IP (tos 0x0, ttl 64, id 62935, offset 0, flags [none], proto TCP (6), length 175)
    172.18.0.3.36905 > 104.40.182.56.10501: Flags [P.], cksum 0xcb17 (incorrect -> 0xb895), seq 1:124, ack 1, win 229, options [nop,nop,TS val 1867389 ecr 164277145], length 123
16:55:27.365045 IP (tos 0x0, ttl 113, id 22164, offset 0, flags [DF], proto TCP (6), length 3886)
    104.40.182.56.10501 > 172.18.0.3.36905: Flags [P.], cksum 0xd996 (incorrect -> 0xdac0), seq 1:3835, ack 124, win 516, options [nop,nop,TS val 164277146 ecr 1867389], length 3834
16:55:27.365350 IP (tos 0x0, ttl 64, id 62939, offset 0, flags [none], proto TCP (6), length 52)
    172.18.0.3.36905 > 104.40.182.56.10501: Flags [.], cksum 0xca9c (incorrect -> 0xe526), ack 3835, win 289, options [nop,nop,TS val 1867393 ecr 164277146], length 0
16:55:27.443456 IP (tos 0x0, ttl 64, id 62959, offset 0, flags [none], proto TCP (6), length 378)
    172.18.0.3.36905 > 104.40.182.56.10501: Flags [P.], cksum 0xcbe2 (incorrect -> 0x1ea1), seq 124:450, ack 3835, win 289, options [nop,nop,TS val 1867413 ecr 164277146], length 326
16:55:27.459884 IP (tos 0x0, ttl 113, id 22167, offset 0, flags [DF], proto TCP (6), length 111)
    104.40.182.56.10501 > 172.18.0.3.36905: Flags [P.], cksum 0xf1e3 (correct), seq 3835:3894, ack 450, win 514, options [nop,nop,TS val 164277156 ecr 1867413], length 59
16:55:27.460196 IP (tos 0x0, ttl 64, id 62960, offset 0, flags [none], proto TCP (6), length 52)
    172.18.0.3.36905 > 104.40.182.56.10501: Flags [.], cksum 0xca9c (incorrect -> 0xe383), ack 3894, win 289, options [nop,nop,TS val 1867417 ecr 164277156], length 0
16:55:27.460849 IP (tos 0x0, ttl 64, id 62961, offset 0, flags [none], proto TCP (6), length 905)
    172.18.0.3.36905 > 104.40.182.56.10501: Flags [P.], cksum 0xcdf1 (incorrect -> 0x5257), seq 450:1303, ack 3894, win 289, options [nop,nop,TS val 1867417 ecr 164277156], length 853
16:55:27.477856 IP (tos 0x0, ttl 113, id 22168, offset 0, flags [DF], proto TCP (6), length 670)
    104.40.182.56.10501 > 172.18.0.3.36905: Flags [P.], cksum 0x3adf (correct), seq 3894:4512, ack 1303, win 511, options [nop,nop,TS val 164277158 ecr 1867417], length 618
16:55:27.478886 IP (tos 0x0, ttl 64, id 62962, offset 0, flags [none], proto TCP (6), length 761)
    172.18.0.3.36905 > 104.40.182.56.10501: Flags [P.], cksum 0xcd61 (incorrect -> 0x8d0d), seq 1303:2012, ack 4512, win 310, options [nop,nop,TS val 1867421 ecr 164277158], length 709
16:55:27.494114 IP (tos 0x0, ttl 113, id 22169, offset 0, flags [DF], proto TCP (6), length 478)
    104.40.182.56.10501 > 172.18.0.3.36905: Flags [P.], cksum 0x334d (correct), seq 4512:4938, ack 2012, win 516, options [nop,nop,TS val 164277159 ecr 1867421], length 426
16:55:27.497940 IP (tos 0x0, ttl 64, id 62966, offset 0, flags [none], proto TCP (6), length 937)
    172.18.0.3.36905 > 104.40.182.56.10501: Flags [P.], cksum 0xce11 (incorrect -> 0x56b6), seq 2012:2897, ack 4938, win 331, options [nop,nop,TS val 1867426 ecr 164277159], length 885
16:55:27.576973 IP (tos 0x0, ttl 113, id 22170, offset 0, flags [DF], proto TCP (6), length 52)
    104.40.182.56.10501 > 172.18.0.3.36905: Flags [.], cksum 0xd4ec (correct), ack 2897, win 512, options [nop,nop,TS val 164277168 ecr 1867426], length 0
16:55:27.587260 IP (tos 0x0, ttl 113, id 22171, offset 0, flags [DF], proto TCP (6), length 2542)
    104.40.182.56.10501 > 172.18.0.3.36905: Flags [P.], cksum 0xd456 (incorrect -> 0x0d13), seq 4938:7428, ack 2897, win 512, options [nop,nop,TS val 164277168 ecr 1867426], length 2490
16:55:27.587556 IP (tos 0x0, ttl 64, id 62985, offset 0, flags [none], proto TCP (6), length 52)
    172.18.0.3.36905 > 104.40.182.56.10501: Flags [.], cksum 0xca9c (incorrect -> 0xcba9), ack 7428, win 370, options [nop,nop,TS val 1867449 ecr 164277168], length 0
16:55:27.593256 IP (tos 0x0, ttl 64, id 62986, offset 0, flags [none], proto TCP (6), length 1561)
    172.18.0.3.36905 > 104.40.182.56.10501: Flags [P.], cksum 0xd081 (incorrect -> 0x3d95), seq 2897:4406, ack 7428, win 370, options [nop,nop,TS val 1867450 ecr 164277168], length 1509
16:55:27.607859 IP (tos 0x0, ttl 113, id 22173, offset 0, flags [DF], proto TCP (6), length 64)
    104.40.182.56.10501 > 172.18.0.3.36905: Flags [.], cksum 0xb45a (correct), ack 2897, win 512, options [nop,nop,TS val 164277171 ecr 1867449,nop,nop,sack 1 {4325:4406}], length 0
```

Note how there's a selective ACK at the end. It looks like the Plastic client in the Docker container sent a >1428 bytes segment, this in turn has been fragmented, and the Plastic Cloud backend received only the 2nd fragment of the two.

**Comment by Kalmalyzer** [comment]
Some relevant comments in Docker issues...

Docker used to set MTU for bridge networks based on eth0 MTU, but stopped doing so ~1-2 years ago: https://github.com/docker/docker/issues/22028  This was intentional: https://github.com/docker/docker/pull/18108

Docker and docker-compose behave differently when configuring MTU but it should  be possible to specify in docker-compose.yml: https://github.com/docker/docker/issues/22297#issuecomment-242934050

The host should get ICMP Fragmentation Needed packets back if the individual TCP datagrams are too big. The earlier tcpdump log does not show those. Someone who shows the PMTUD process working: https://github.com/docker/docker/pull/18108#issuecomment-159784979

More MTU troubleshooting from other people: https://github.com/docker/docker/issues/26473

**Comment by Kalmalyzer** [comment]
Lowering MTU by modifying docker-compose.yml worked. Closing for now.
